{
  "schema_version": 1,
  "registry_version": "1.3-0",
  "current_write_version": "1.2-c3",
  "readable_versions": ["1.2-c3"],
  "compatibility_policy": "Readers accept only declared versions. Existing frozen schemas are immutable; additive or breaking changes require a new schema version and an explicit adapter.",
  "schemas": {
    "1.2-c3": {
      "path": "data/engineering_knowledge.schema.json",
      "sha256": "1432b4df7972b921968a2ad275bbfefe4ab843d2257f64268b556a020860eca1",
      "hash_format": "canonical-json-v1",
      "status": "frozen"
    }
  }
}
